{
  "schemaId": "atm.stewardApplyEvidence.v1",
  "specVersion": "0.1.0",
  "migration": {
    "strategy": "none",
    "fromVersion": null,
    "notes": "neutral write steward apply"
  },
  "stewardId": "neutral-write-steward",
  "mergePlanId": "merge-18e5ac12fe597b42",
  "proposalIds": [
    "prop-hist-w1-django_db_backends_mysql_schema_py"
  ],
  "targetFiles": [
    "django/db/backends/mysql/schema.py"
  ],
  "appliedFiles": [
    "django/db/backends/mysql/schema.py"
  ],
  "fileBeforeHashes": {
    "django/db/backends/mysql/schema.py": "031849339474c86d05e138d53e0dba2558487e1ae7f6181acf54b52f2c1d8a38"
  },
  "fileAfterHashes": {
    "django/db/backends/mysql/schema.py": "30b4d711d299f40f045ba0eaa881633e4d1d54e953f45420676477cba7eeeb30"
  },
  "permissions": {
    "fileWrite": [
      "django/db/backends/mysql/schema.py"
    ],
    "gitWrite": false,
    "taskLifecycle": false,
    "selfClose": false
  },
  "applyMethod": "patch-apply",
  "verdict": "applied",
  "brokerOperationRun": {
    "schemaId": "atm.brokerOperationRunRecordEnvelope.v1",
    "specVersion": "0.1.0",
    "migration": {
      "strategy": "none",
      "fromVersion": null,
      "notes": "deterministic compose"
    },
    "runId": "steward-merge-18e5ac12fe597b42",
    "planId": "merge-18e5ac12fe597b42",
    "records": [
      {
        "schemaId": "atm.brokerOperationRunRecord.v1",
        "specVersion": "0.1.0",
        "migration": {
          "strategy": "none",
          "fromVersion": null,
          "notes": "deterministic compose"
        },
        "runId": "steward-merge-18e5ac12fe597b42",
        "planId": "merge-18e5ac12fe597b42",
        "request_identity": [
          "prop-hist-w1-django_db_backends_mysql_schema_py"
        ],
        "actor_ids": [
          "writer-19021"
        ],
        "request_files": [
          "django/db/backends/mysql/schema.py"
        ],
        "adapter_choice": "steward.patch-apply",
        "applied_files": [
          "django/db/backends/mysql/schema.py"
        ],
        "lane_decision": "neutral-steward",
        "merge_verdict": "mergeable",
        "evidence_path": "/workspace/reports/hist-main/main-2026-10-10/main/django/runs/django_18209_19021__steward__s4/artifacts/steward/cb-django_db_backends_mysql_schema.py-w1-0003.json",
        "task_ids": [
          "TASK-PROP-HIST-W1-DJANGO_DB_BACKENDS_MYSQL_SCHEMA_PY"
        ],
        "commit_sha": "0881a7a4f201c717b68e880169b5e1328f3d9fa0"
      }
    ]
  }
}
