{
  "schemaId": "atm.stewardApplyEvidence.v1",
  "specVersion": "0.1.0",
  "migration": {
    "strategy": "none",
    "fromVersion": null,
    "notes": "neutral write steward apply"
  },
  "stewardId": "neutral-write-steward",
  "mergePlanId": "merge-11e57255e36125e1",
  "proposalIds": [
    "prop-hist-w1-src_pytest_fixtures_py"
  ],
  "targetFiles": [
    "src/_pytest/fixtures.py"
  ],
  "appliedFiles": [],
  "fileBeforeHashes": {},
  "fileAfterHashes": {},
  "permissions": {
    "fileWrite": [
      "src/_pytest/fixtures.py"
    ],
    "gitWrite": false,
    "taskLifecycle": false,
    "selfClose": false
  },
  "applyMethod": "patch-apply",
  "verdict": "blocked",
  "blockedReasons": [
    "compose-context-mismatch: proposal 'prop-hist-w1-src_pytest_fixtures_py' context mismatch at base line 552: expected \"                raise\", found \"                fixturedef = self._getnextfixturedef(argname)\" [proposals: prop-hist-w1-src_pytest_fixtures_py]"
  ],
  "brokerOperationRun": {
    "schemaId": "atm.brokerOperationRunRecordEnvelope.v1",
    "specVersion": "0.1.0",
    "migration": {
      "strategy": "none",
      "fromVersion": null,
      "notes": "deterministic compose"
    },
    "runId": "steward-merge-11e57255e36125e1",
    "planId": "merge-11e57255e36125e1",
    "records": [
      {
        "schemaId": "atm.brokerOperationRunRecord.v1",
        "specVersion": "0.1.0",
        "migration": {
          "strategy": "none",
          "fromVersion": null,
          "notes": "deterministic compose"
        },
        "runId": "steward-merge-11e57255e36125e1",
        "planId": "merge-11e57255e36125e1",
        "request_identity": [
          "prop-hist-w1-src_pytest_fixtures_py"
        ],
        "actor_ids": [
          "writer-12092"
        ],
        "request_files": [
          "src/_pytest/fixtures.py"
        ],
        "adapter_choice": "steward.patch-apply",
        "applied_files": [],
        "lane_decision": "neutral-steward",
        "merge_verdict": "mergeable",
        "evidence_path": "/workspace/reports/hist-main/main-v2-2026-10-10/main/pytest/runs/pytest_11833_12092__bare_composer__s3/artifacts/steward/cb-src__pytest_fixtures.py-w1-0001.json",
        "task_ids": [
          "TASK-PROP-HIST-W1-SRC_PYTEST_FIXTURES_PY"
        ],
        "commit_sha": "a0ca18548ca029e31315af3108c60307240d67e0"
      }
    ]
  }
}
