{
  "schemaId": "atm.stewardApplyEvidence.v1",
  "specVersion": "0.1.0",
  "migration": {
    "strategy": "none",
    "fromVersion": null,
    "notes": "neutral write steward apply"
  },
  "stewardId": "neutral-write-steward",
  "mergePlanId": "merge-4a63afbda8ac7262",
  "proposalIds": [
    "prop-hist-w0-sympy_core_basic_py"
  ],
  "targetFiles": [
    "sympy/core/basic.py"
  ],
  "appliedFiles": [
    "sympy/core/basic.py"
  ],
  "fileBeforeHashes": {
    "sympy/core/basic.py": "359bb7e7e0c38a12ceb63bb4f4b4e02b2a2087da1af2f10defb73a1ea03abffb"
  },
  "fileAfterHashes": {
    "sympy/core/basic.py": "2d50eb7580b3556aa9e6b62b0fe9fcdd4357021dc7c56c8c018bda1ec708f5cf"
  },
  "permissions": {
    "fileWrite": [
      "sympy/core/basic.py"
    ],
    "gitWrite": false,
    "taskLifecycle": false,
    "selfClose": false
  },
  "applyMethod": "patch-apply",
  "verdict": "applied",
  "brokerOperationRun": {
    "schemaId": "atm.brokerOperationRunRecordEnvelope.v1",
    "specVersion": "0.1.0",
    "migration": {
      "strategy": "none",
      "fromVersion": null,
      "notes": "deterministic compose"
    },
    "runId": "steward-merge-4a63afbda8ac7262",
    "planId": "merge-4a63afbda8ac7262",
    "records": [
      {
        "schemaId": "atm.brokerOperationRunRecord.v1",
        "specVersion": "0.1.0",
        "migration": {
          "strategy": "none",
          "fromVersion": null,
          "notes": "deterministic compose"
        },
        "runId": "steward-merge-4a63afbda8ac7262",
        "planId": "merge-4a63afbda8ac7262",
        "request_identity": [
          "prop-hist-w0-sympy_core_basic_py"
        ],
        "actor_ids": [
          "writer-27086"
        ],
        "request_files": [
          "sympy/core/basic.py"
        ],
        "adapter_choice": "steward.patch-apply",
        "applied_files": [
          "sympy/core/basic.py"
        ],
        "lane_decision": "neutral-steward",
        "merge_verdict": "mergeable",
        "evidence_path": "/workspace/reports/hist-main/main-v2-2026-10-10/main/sympy/runs/sympy_27086_27175__steward__s1/artifacts/steward/cb-sympy_core_basic.py-w0-0001.json",
        "task_ids": [
          "TASK-PROP-HIST-W0-SYMPY_CORE_BASIC_PY"
        ],
        "commit_sha": "4af71aa131a5d0e632614cbeedbc120d6b752834"
      }
    ]
  }
}
