{
  "schemaId": "atm.stewardApplyEvidence.v1",
  "specVersion": "0.1.0",
  "migration": {
    "strategy": "none",
    "fromVersion": null,
    "notes": "neutral write steward apply"
  },
  "stewardId": "neutral-write-steward",
  "mergePlanId": "merge-8e03e92dd9ad61c1",
  "proposalIds": [
    "prop-hist-w1-django_db_models_base_py"
  ],
  "targetFiles": [
    "django/db/models/base.py"
  ],
  "appliedFiles": [
    "django/db/models/base.py"
  ],
  "fileBeforeHashes": {
    "django/db/models/base.py": "88563ed56be4eef5d72f03a33a4a37144c28e559c925c7bafa2d9d01bb343583"
  },
  "fileAfterHashes": {
    "django/db/models/base.py": "e3573ed3d3420de44e2f5c756cf0ecaddacb8cfdd8fb50fd45a15c340a27e703"
  },
  "permissions": {
    "fileWrite": [
      "django/db/models/base.py"
    ],
    "gitWrite": false,
    "taskLifecycle": false,
    "selfClose": false
  },
  "applyMethod": "patch-apply",
  "verdict": "applied",
  "brokerOperationRun": {
    "schemaId": "atm.brokerOperationRunRecordEnvelope.v1",
    "specVersion": "0.1.0",
    "migration": {
      "strategy": "none",
      "fromVersion": null,
      "notes": "deterministic compose"
    },
    "runId": "steward-merge-8e03e92dd9ad61c1",
    "planId": "merge-8e03e92dd9ad61c1",
    "records": [
      {
        "schemaId": "atm.brokerOperationRunRecord.v1",
        "specVersion": "0.1.0",
        "migration": {
          "strategy": "none",
          "fromVersion": null,
          "notes": "deterministic compose"
        },
        "runId": "steward-merge-8e03e92dd9ad61c1",
        "planId": "merge-8e03e92dd9ad61c1",
        "request_identity": [
          "prop-hist-w1-django_db_models_base_py"
        ],
        "actor_ids": [
          "writer-19018"
        ],
        "request_files": [
          "django/db/models/base.py"
        ],
        "adapter_choice": "steward.patch-apply",
        "applied_files": [
          "django/db/models/base.py"
        ],
        "lane_decision": "neutral-steward",
        "merge_verdict": "mergeable",
        "evidence_path": "/workspace/reports/hist-main/main-v2-2026-10-10/main/django/runs/django_18909_19018__steward__s2/artifacts/steward/cb-django_db_models_base.py-w1-0003.json",
        "task_ids": [
          "TASK-PROP-HIST-W1-DJANGO_DB_MODELS_BASE_PY"
        ],
        "commit_sha": "b6c4f7b99ef63821a809d9cfa73a8896dca27723"
      }
    ]
  }
}
