{
  "schemaId": "atm.stewardApplyEvidence.v1",
  "specVersion": "0.1.0",
  "migration": {
    "strategy": "none",
    "fromVersion": null,
    "notes": "neutral write steward apply"
  },
  "stewardId": "neutral-write-steward",
  "mergePlanId": "merge-d1341c3d877742ac",
  "proposalIds": [
    "prop-hist-w0-xarray_core_variable_py"
  ],
  "targetFiles": [
    "xarray/core/variable.py"
  ],
  "appliedFiles": [
    "xarray/core/variable.py"
  ],
  "fileBeforeHashes": {
    "xarray/core/variable.py": "e63212cce5854eea935ae76750e955aa5cddf1a9ae8c13ce72bbdc710b104359"
  },
  "fileAfterHashes": {
    "xarray/core/variable.py": "9c838cfd90a28c85daca3a336bdf3fbca8306b8e76bd407910eed62958021be8"
  },
  "permissions": {
    "fileWrite": [
      "xarray/core/variable.py"
    ],
    "gitWrite": false,
    "taskLifecycle": false,
    "selfClose": false
  },
  "applyMethod": "patch-apply",
  "verdict": "applied",
  "brokerOperationRun": {
    "schemaId": "atm.brokerOperationRunRecordEnvelope.v1",
    "specVersion": "0.1.0",
    "migration": {
      "strategy": "none",
      "fromVersion": null,
      "notes": "deterministic compose"
    },
    "runId": "steward-merge-d1341c3d877742ac",
    "planId": "merge-d1341c3d877742ac",
    "records": [
      {
        "schemaId": "atm.brokerOperationRunRecord.v1",
        "specVersion": "0.1.0",
        "migration": {
          "strategy": "none",
          "fromVersion": null,
          "notes": "deterministic compose"
        },
        "runId": "steward-merge-d1341c3d877742ac",
        "planId": "merge-d1341c3d877742ac",
        "request_identity": [
          "prop-hist-w0-xarray_core_variable_py"
        ],
        "actor_ids": [
          "writer-9720"
        ],
        "request_files": [
          "xarray/core/variable.py"
        ],
        "adapter_choice": "steward.patch-apply",
        "applied_files": [
          "xarray/core/variable.py"
        ],
        "lane_decision": "neutral-steward",
        "merge_verdict": "mergeable",
        "evidence_path": "/workspace/reports/hist-main/main-v2-2026-10-10/main/xarray/runs/xarray_9720_9749__bare_composer__s2/artifacts/steward/cb-xarray_core_variable.py-w0-0002.json",
        "task_ids": [
          "TASK-PROP-HIST-W0-XARRAY_CORE_VARIABLE_PY"
        ],
        "commit_sha": "0803e0de1b9735d066c1a1088e9f0deb20455a8f"
      }
    ]
  }
}
