{
  "schemaId": "atm.stewardApplyEvidence.v1",
  "specVersion": "0.1.0",
  "migration": {
    "strategy": "none",
    "fromVersion": null,
    "notes": "neutral write steward apply"
  },
  "stewardId": "neutral-write-steward",
  "mergePlanId": "merge-c9db7579fa03ca75",
  "proposalIds": [
    "prop-hist-w1-django_db_models_query_py"
  ],
  "targetFiles": [
    "django/db/models/query.py"
  ],
  "appliedFiles": [
    "django/db/models/query.py"
  ],
  "fileBeforeHashes": {
    "django/db/models/query.py": "0c8cc324246cb1724f93721abdab1e64cb6940d22e038cf6fa583a30cdd89d23"
  },
  "fileAfterHashes": {
    "django/db/models/query.py": "add98891e7615c1687a86bdfd342376296ee3c770288b0e9223c657be654db94"
  },
  "permissions": {
    "fileWrite": [
      "django/db/models/query.py"
    ],
    "gitWrite": false,
    "taskLifecycle": false,
    "selfClose": false
  },
  "applyMethod": "patch-apply",
  "verdict": "applied",
  "brokerOperationRun": {
    "schemaId": "atm.brokerOperationRunRecordEnvelope.v1",
    "specVersion": "0.1.0",
    "migration": {
      "strategy": "none",
      "fromVersion": null,
      "notes": "deterministic compose"
    },
    "runId": "steward-merge-c9db7579fa03ca75",
    "planId": "merge-c9db7579fa03ca75",
    "records": [
      {
        "schemaId": "atm.brokerOperationRunRecord.v1",
        "specVersion": "0.1.0",
        "migration": {
          "strategy": "none",
          "fromVersion": null,
          "notes": "deterministic compose"
        },
        "runId": "steward-merge-c9db7579fa03ca75",
        "planId": "merge-c9db7579fa03ca75",
        "request_identity": [
          "prop-hist-w1-django_db_models_query_py"
        ],
        "actor_ids": [
          "writer-17893"
        ],
        "request_files": [
          "django/db/models/query.py"
        ],
        "adapter_choice": "steward.patch-apply",
        "applied_files": [
          "django/db/models/query.py"
        ],
        "lane_decision": "neutral-steward",
        "merge_verdict": "mergeable",
        "evidence_path": "/workspace/reports/hist-main/main-2026-10-10/main/django/runs/django_17831_17893__bare_composer__s2/artifacts/steward/cb-django_db_models_query.py-w1-0009.json",
        "task_ids": [
          "TASK-PROP-HIST-W1-DJANGO_DB_MODELS_QUERY_PY"
        ],
        "commit_sha": "a96e9f3aac575bc0656bae483634f5b2b7d028e6"
      }
    ]
  }
}
