{
  "schemaId": "atm.stewardApplyEvidence.v1",
  "specVersion": "0.1.0",
  "migration": {
    "strategy": "none",
    "fromVersion": null,
    "notes": "neutral write steward apply"
  },
  "stewardId": "neutral-write-steward",
  "mergePlanId": "merge-78bfbeb7306ef734",
  "proposalIds": [
    "prop-hist-w1-fastapi_security_oauth2_py"
  ],
  "targetFiles": [
    "fastapi/security/oauth2.py"
  ],
  "appliedFiles": [
    "fastapi/security/oauth2.py"
  ],
  "fileBeforeHashes": {
    "fastapi/security/oauth2.py": "c42a398f5aa9cdee82bc4b891c89de388d2fd9fa1d1953291c75671e988b7e83"
  },
  "fileAfterHashes": {
    "fastapi/security/oauth2.py": "b95b7a4f656d4074d59cc46f6e3965eccc9c3202188a495b5b026b7e189ea16d"
  },
  "permissions": {
    "fileWrite": [
      "fastapi/security/oauth2.py"
    ],
    "gitWrite": false,
    "taskLifecycle": false,
    "selfClose": false
  },
  "applyMethod": "patch-apply",
  "verdict": "applied",
  "brokerOperationRun": {
    "schemaId": "atm.brokerOperationRunRecordEnvelope.v1",
    "specVersion": "0.1.0",
    "migration": {
      "strategy": "none",
      "fromVersion": null,
      "notes": "deterministic compose"
    },
    "runId": "steward-merge-78bfbeb7306ef734",
    "planId": "merge-78bfbeb7306ef734",
    "records": [
      {
        "schemaId": "atm.brokerOperationRunRecord.v1",
        "specVersion": "0.1.0",
        "migration": {
          "strategy": "none",
          "fromVersion": null,
          "notes": "deterministic compose"
        },
        "runId": "steward-merge-78bfbeb7306ef734",
        "planId": "merge-78bfbeb7306ef734",
        "request_identity": [
          "prop-hist-w1-fastapi_security_oauth2_py"
        ],
        "actor_ids": [
          "writer-11460"
        ],
        "request_files": [
          "fastapi/security/oauth2.py"
        ],
        "adapter_choice": "steward.patch-apply",
        "applied_files": [
          "fastapi/security/oauth2.py"
        ],
        "lane_decision": "neutral-steward",
        "merge_verdict": "mergeable",
        "evidence_path": "/workspace/reports/hist-main/main-v2-2026-10-10/main/fastapi/runs/fastapi_9783_11460__steward__s0/artifacts/steward/cb-fastapi_security_oauth2.py-w1-0001.json",
        "task_ids": [
          "TASK-PROP-HIST-W1-FASTAPI_SECURITY_OAUTH2_PY"
        ],
        "commit_sha": "7d77f0b102cfa8f26604a3b0e5a5d1a7a2187046"
      }
    ]
  }
}
