{
  "schemaId": "atm.stewardApplyEvidence.v1",
  "specVersion": "0.1.0",
  "migration": {
    "strategy": "none",
    "fromVersion": null,
    "notes": "neutral write steward apply"
  },
  "stewardId": "neutral-write-steward",
  "mergePlanId": "merge-a87c4071c9d52e22",
  "proposalIds": [
    "prop-hist-w0-django_db_models_functions_uuid_py"
  ],
  "targetFiles": [
    "django/db/models/functions/uuid.py"
  ],
  "appliedFiles": [],
  "fileBeforeHashes": {},
  "fileAfterHashes": {},
  "permissions": {
    "fileWrite": [
      "django/db/models/functions/uuid.py"
    ],
    "gitWrite": false,
    "taskLifecycle": false,
    "selfClose": false
  },
  "applyMethod": "patch-apply",
  "verdict": "blocked",
  "blockedReasons": [
    "file-hash-drift: Target file does not exist: django/db/models/functions/uuid.py"
  ],
  "brokerOperationRun": {
    "schemaId": "atm.brokerOperationRunRecordEnvelope.v1",
    "specVersion": "0.1.0",
    "migration": {
      "strategy": "none",
      "fromVersion": null,
      "notes": "deterministic compose"
    },
    "runId": "steward-merge-a87c4071c9d52e22",
    "planId": "merge-a87c4071c9d52e22",
    "records": [
      {
        "schemaId": "atm.brokerOperationRunRecord.v1",
        "specVersion": "0.1.0",
        "migration": {
          "strategy": "none",
          "fromVersion": null,
          "notes": "deterministic compose"
        },
        "runId": "steward-merge-a87c4071c9d52e22",
        "planId": "merge-a87c4071c9d52e22",
        "request_identity": [
          "prop-hist-w0-django_db_models_functions_uuid_py"
        ],
        "actor_ids": [
          "writer-20282"
        ],
        "request_files": [
          "django/db/models/functions/uuid.py"
        ],
        "adapter_choice": "steward.patch-apply",
        "applied_files": [],
        "lane_decision": "neutral-steward",
        "merge_verdict": "mergeable",
        "evidence_path": "/workspace/reports/hist-main/main-v2-2026-10-10/main/django/runs/django_20282_20286__bare_composer__s3/artifacts/steward/cb-django_db_models_functions_uuid.py-w0-0005.json",
        "task_ids": [
          "TASK-PROP-HIST-W0-DJANGO_DB_MODELS_FUNCTIONS_UUID_PY"
        ],
        "commit_sha": "98d489222168611121857204abaeddab1cf83328"
      }
    ]
  }
}
