{
  "schemaId": "atm.stewardApplyEvidence.v1",
  "specVersion": "0.1.0",
  "migration": {
    "strategy": "none",
    "fromVersion": null,
    "notes": "neutral write steward apply"
  },
  "stewardId": "neutral-write-steward",
  "mergePlanId": "merge-e915b9d9e4b504ed",
  "proposalIds": [
    "prop-hist-w1-sphinx_util_typing_py"
  ],
  "targetFiles": [
    "sphinx/util/typing.py"
  ],
  "appliedFiles": [
    "sphinx/util/typing.py"
  ],
  "fileBeforeHashes": {
    "sphinx/util/typing.py": "4e30fc17ea4c8e177becd8de5f408c2a4ae5f4d84dd13edaaedd3dc134965792"
  },
  "fileAfterHashes": {
    "sphinx/util/typing.py": "394463fe4a809ee86275011c09c882e2c2e3aed2bf5e8751ff080d4398a60e49"
  },
  "permissions": {
    "fileWrite": [
      "sphinx/util/typing.py"
    ],
    "gitWrite": false,
    "taskLifecycle": false,
    "selfClose": false
  },
  "applyMethod": "patch-apply",
  "verdict": "applied",
  "brokerOperationRun": {
    "schemaId": "atm.brokerOperationRunRecordEnvelope.v1",
    "specVersion": "0.1.0",
    "migration": {
      "strategy": "none",
      "fromVersion": null,
      "notes": "deterministic compose"
    },
    "runId": "steward-merge-e915b9d9e4b504ed",
    "planId": "merge-e915b9d9e4b504ed",
    "records": [
      {
        "schemaId": "atm.brokerOperationRunRecord.v1",
        "specVersion": "0.1.0",
        "migration": {
          "strategy": "none",
          "fromVersion": null,
          "notes": "deterministic compose"
        },
        "runId": "steward-merge-e915b9d9e4b504ed",
        "planId": "merge-e915b9d9e4b504ed",
        "request_identity": [
          "prop-hist-w1-sphinx_util_typing_py"
        ],
        "actor_ids": [
          "writer-12003"
        ],
        "request_files": [
          "sphinx/util/typing.py"
        ],
        "adapter_choice": "steward.patch-apply",
        "applied_files": [
          "sphinx/util/typing.py"
        ],
        "lane_decision": "neutral-steward",
        "merge_verdict": "mergeable",
        "evidence_path": "/workspace/reports/hist-main/main-v2-2026-10-10/main/sphinx/runs/sphinx_11898_12003__steward__s4/artifacts/steward/cb-sphinx_util_typing.py-w1-0004.json",
        "task_ids": [
          "TASK-PROP-HIST-W1-SPHINX_UTIL_TYPING_PY"
        ],
        "commit_sha": "fbc2593d081f016774e9047765587b6bb61b1097"
      }
    ]
  }
}
