{
  "schemaId": "atm.stewardApplyEvidence.v1",
  "specVersion": "0.1.0",
  "migration": {
    "strategy": "none",
    "fromVersion": null,
    "notes": "neutral write steward apply"
  },
  "stewardId": "neutral-write-steward",
  "mergePlanId": "merge-6016e97e56f2af71",
  "proposalIds": [
    "prop-hist-w1-sympy_physics_mechanics_init_py"
  ],
  "targetFiles": [
    "sympy/physics/mechanics/__init__.py"
  ],
  "appliedFiles": [
    "sympy/physics/mechanics/__init__.py"
  ],
  "fileBeforeHashes": {
    "sympy/physics/mechanics/__init__.py": "18e5e5c5c9ccb9c539cdcffc3243384a6ba8034cf51934a1c14f3e8bfdb0e1ed"
  },
  "fileAfterHashes": {
    "sympy/physics/mechanics/__init__.py": "a558c017588ca0723adfdee2f6307e2f4fd20bb0b00dd294cca70d07a73bbb13"
  },
  "permissions": {
    "fileWrite": [
      "sympy/physics/mechanics/__init__.py"
    ],
    "gitWrite": false,
    "taskLifecycle": false,
    "selfClose": false
  },
  "applyMethod": "patch-apply",
  "verdict": "applied",
  "brokerOperationRun": {
    "schemaId": "atm.brokerOperationRunRecordEnvelope.v1",
    "specVersion": "0.1.0",
    "migration": {
      "strategy": "none",
      "fromVersion": null,
      "notes": "deterministic compose"
    },
    "runId": "steward-merge-6016e97e56f2af71",
    "planId": "merge-6016e97e56f2af71",
    "records": [
      {
        "schemaId": "atm.brokerOperationRunRecord.v1",
        "specVersion": "0.1.0",
        "migration": {
          "strategy": "none",
          "fromVersion": null,
          "notes": "deterministic compose"
        },
        "runId": "steward-merge-6016e97e56f2af71",
        "planId": "merge-6016e97e56f2af71",
        "request_identity": [
          "prop-hist-w1-sympy_physics_mechanics_init_py"
        ],
        "actor_ids": [
          "writer-26438"
        ],
        "request_files": [
          "sympy/physics/mechanics/__init__.py"
        ],
        "adapter_choice": "steward.patch-apply",
        "applied_files": [
          "sympy/physics/mechanics/__init__.py"
        ],
        "lane_decision": "neutral-steward",
        "merge_verdict": "mergeable",
        "evidence_path": "/workspace/reports/hist-main/main-2026-10-10/main/sympy/runs/sympy_26412_26438__steward__s4/artifacts/steward/cb-sympy_physics_mechanics___init__.py-w1-0001.json",
        "task_ids": [
          "TASK-PROP-HIST-W1-SYMPY_PHYSICS_MECHANICS_INIT_PY"
        ],
        "commit_sha": "40fa1e8a1d79b75e7c05633d8bd77dc586f522e2"
      }
    ]
  }
}
