{
  "schemaId": "atm.stewardApplyEvidence.v1",
  "specVersion": "0.1.0",
  "migration": {
    "strategy": "none",
    "fromVersion": null,
    "notes": "neutral write steward apply"
  },
  "stewardId": "neutral-write-steward",
  "mergePlanId": "merge-03b0273c1b2d108f",
  "proposalIds": [
    "prop-hist-w0-fastapi_compat_py"
  ],
  "targetFiles": [
    "fastapi/_compat.py"
  ],
  "appliedFiles": [],
  "fileBeforeHashes": {},
  "fileAfterHashes": {},
  "permissions": {
    "fileWrite": [
      "fastapi/_compat.py"
    ],
    "gitWrite": false,
    "taskLifecycle": false,
    "selfClose": false
  },
  "applyMethod": "patch-apply",
  "verdict": "blocked",
  "blockedReasons": [
    "file-hash-drift: Target file hash sha256:9f57210ba06236e05b5d59ef3ac9194a8ffcfd5799d844a8c9a1bd82de3c5bf8 does not match proposal fileBeforeHash sha256:110c8d63eaab377723c08d6bebd25501139cda5402be2e96d707baffb8f1fe07."
  ],
  "brokerOperationRun": {
    "schemaId": "atm.brokerOperationRunRecordEnvelope.v1",
    "specVersion": "0.1.0",
    "migration": {
      "strategy": "none",
      "fromVersion": null,
      "notes": "deterministic compose"
    },
    "runId": "steward-merge-03b0273c1b2d108f",
    "planId": "merge-03b0273c1b2d108f",
    "records": [
      {
        "schemaId": "atm.brokerOperationRunRecord.v1",
        "specVersion": "0.1.0",
        "migration": {
          "strategy": "none",
          "fromVersion": null,
          "notes": "deterministic compose"
        },
        "runId": "steward-merge-03b0273c1b2d108f",
        "planId": "merge-03b0273c1b2d108f",
        "request_identity": [
          "prop-hist-w0-fastapi_compat_py"
        ],
        "actor_ids": [
          "writer-12942"
        ],
        "request_files": [
          "fastapi/_compat.py"
        ],
        "adapter_choice": "steward.patch-apply",
        "applied_files": [],
        "lane_decision": "neutral-steward",
        "merge_verdict": "mergeable",
        "evidence_path": "/workspace/reports/hist-main/main-v2-2026-10-10/main/fastapi/runs/fastapi_12942_14036__steward__s4/artifacts/steward/cb-fastapi__compat.py-w0-0001.json",
        "task_ids": [
          "TASK-PROP-HIST-W0-FASTAPI_COMPAT_PY"
        ],
        "commit_sha": "fc6c7be28da28e5ea739246cc7e95c3057d8a47b"
      }
    ]
  }
}
