{
  "schemaId": "atm.stewardApplyEvidence.v1",
  "specVersion": "0.1.0",
  "migration": {
    "strategy": "none",
    "fromVersion": null,
    "notes": "neutral write steward apply"
  },
  "stewardId": "neutral-write-steward",
  "mergePlanId": "merge-a3f9bdfa9d454349",
  "proposalIds": [
    "prop-hist-w1-docs_src_security_tutorial005_an_py39_py"
  ],
  "targetFiles": [
    "docs_src/security/tutorial005_an_py39.py"
  ],
  "appliedFiles": [
    "docs_src/security/tutorial005_an_py39.py"
  ],
  "fileBeforeHashes": {
    "docs_src/security/tutorial005_an_py39.py": "49644cc758b768d7b7127339842bf16c0803892539183c0fda26a0b8e2b46091"
  },
  "fileAfterHashes": {
    "docs_src/security/tutorial005_an_py39.py": "ff1ea00a4a2ae1a0427364518f125f1c8457f0948e57f7654e2b2b2ba1ce60c3"
  },
  "permissions": {
    "fileWrite": [
      "docs_src/security/tutorial005_an_py39.py"
    ],
    "gitWrite": false,
    "taskLifecycle": false,
    "selfClose": false
  },
  "applyMethod": "patch-apply",
  "verdict": "applied",
  "brokerOperationRun": {
    "schemaId": "atm.brokerOperationRunRecordEnvelope.v1",
    "specVersion": "0.1.0",
    "migration": {
      "strategy": "none",
      "fromVersion": null,
      "notes": "deterministic compose"
    },
    "runId": "steward-merge-a3f9bdfa9d454349",
    "planId": "merge-a3f9bdfa9d454349",
    "records": [
      {
        "schemaId": "atm.brokerOperationRunRecord.v1",
        "specVersion": "0.1.0",
        "migration": {
          "strategy": "none",
          "fromVersion": null,
          "notes": "deterministic compose"
        },
        "runId": "steward-merge-a3f9bdfa9d454349",
        "planId": "merge-a3f9bdfa9d454349",
        "request_identity": [
          "prop-hist-w1-docs_src_security_tutorial005_an_py39_py"
        ],
        "actor_ids": [
          "writer-11589"
        ],
        "request_files": [
          "docs_src/security/tutorial005_an_py39.py"
        ],
        "adapter_choice": "steward.patch-apply",
        "applied_files": [
          "docs_src/security/tutorial005_an_py39.py"
        ],
        "lane_decision": "neutral-steward",
        "merge_verdict": "mergeable",
        "evidence_path": "/workspace/reports/hist-main/main-v2-2026-10-10/o0/runs/fastapi_9700_11589__steward__s2/artifacts/steward/cb-docs_src_security_tutorial005_an_py39.py-w1-0003.json",
        "task_ids": [
          "TASK-PROP-HIST-W1-DOCS_SRC_SECURITY_TUTORIAL005_AN_PY39_PY"
        ],
        "commit_sha": "88914b9bd8a8159c0a5b66ddd1cc2de68aa9648f"
      }
    ]
  }
}
